{
  "schema_version": 1,
  "version": "0.1.0",
  "runtime": {
    "linux-arm64": { "url": "https://github.com/karthiknambiar/csm-skills-framework/releases/download/v0.1.0/csaf-runtime-0.1.0-linux-arm64.zip", "sha256": "1111111111111111111111111111111111111111111111111111111111111111", "size": 101 },
    "linux-x64": { "url": "https://github.com/karthiknambiar/csm-skills-framework/releases/download/v0.1.0/csaf-runtime-0.1.0-linux-x64.zip", "sha256": "2222222222222222222222222222222222222222222222222222222222222222", "size": 102 },
    "macos-arm64": { "url": "https://github.com/karthiknambiar/csm-skills-framework/releases/download/v0.1.0/csaf-runtime-0.1.0-macos-arm64.zip", "sha256": "3333333333333333333333333333333333333333333333333333333333333333", "size": 103 },
    "macos-x64": { "url": "https://github.com/karthiknambiar/csm-skills-framework/releases/download/v0.1.0/csaf-runtime-0.1.0-macos-x64.zip", "sha256": "4444444444444444444444444444444444444444444444444444444444444444", "size": 104 },
    "windows-arm64": { "url": "https://github.com/karthiknambiar/csm-skills-framework/releases/download/v0.1.0/csaf-runtime-0.1.0-windows-arm64.zip", "sha256": "5555555555555555555555555555555555555555555555555555555555555555", "size": 105 },
    "windows-x64": { "url": "https://github.com/karthiknambiar/csm-skills-framework/releases/download/v0.1.0/csaf-runtime-0.1.0-windows-x64.zip", "sha256": "6666666666666666666666666666666666666666666666666666666666666666", "size": 106 }
  },
  "codex_skill": { "url": "https://github.com/karthiknambiar/csm-skills-framework/releases/download/v0.1.0/csaf-codex-skill-0.1.0.zip", "sha256": "7777777777777777777777777777777777777777777777777777777777777777", "size": 107 },
  "claude_plugin": { "url": "https://github.com/karthiknambiar/csm-skills-framework/releases/download/v0.1.0/csaf-claude-plugin-0.1.0.zip", "sha256": "8888888888888888888888888888888888888888888888888888888888888888", "size": 108 },
  "officecli": {
    "version": "1.0.143",
    "minimum_version": "1.0.137",
    "assets": {
      "linux-arm64": { "url": "https://github.com/iOfficeAI/OfficeCLI/releases/download/v1.0.143/officecli-linux-arm64", "sha256": "c50298e4698fcd1b15fe1a0f096405ad260b5c84d4440882582d0bba1e57bd49", "size": 34708999 },
      "linux-x64": { "url": "https://github.com/iOfficeAI/OfficeCLI/releases/download/v1.0.143/officecli-linux-x64", "sha256": "6a29c598a789b57c92c03e560907d3f131a4bd0a068785b1d338a86fc31a58a7", "size": 35293861 },
      "macos-arm64": { "url": "https://github.com/iOfficeAI/OfficeCLI/releases/download/v1.0.143/officecli-mac-arm64", "sha256": "2f158d46f9b6c5eb0dfe4eb02038114001e17acc47b67347417c56dcf9659096", "size": 33740304 },
      "macos-x64": { "url": "https://github.com/iOfficeAI/OfficeCLI/releases/download/v1.0.143/officecli-mac-x64", "sha256": "693d243db616c74705fec9d92fdfc8a3db36acfcea378edb7264c2a30d339d9c", "size": 34680704 },
      "windows-arm64": { "url": "https://github.com/iOfficeAI/OfficeCLI/releases/download/v1.0.143/officecli-win-arm64.exe", "sha256": "51baf511fe136ee216fcc13cf0da9d18078da42212b22805c3a81f4163a4d7b9", "size": 33800116 },
      "windows-x64": { "url": "https://github.com/iOfficeAI/OfficeCLI/releases/download/v1.0.143/officecli-win-x64.exe", "sha256": "d4d4c10fced307e209744cf98a56b003a6e613424fd651b08469274704afd2c6", "size": 33357736 }
    }
  }
}